{
  "chainId": 56,
  "name": "BNB Smart Chain",
  "hardhatNetwork": "bsc",
  "status": "live",
  "nativeToken": { "symbol": "BNB", "decimals": 18 },
  "rpcEnv": "BSC_MAINNET_RPC",
  "explorer": {
    "browserURL": "https://bscscan.com",
    "apiURL": "https://api.bscscan.com/api"
  },
  "explorerApiEnv": "ETHERSCAN_API_KEY",
  "tokens": [],
  "contracts": {
    "orderManagerProxy": "0x4CDa31fc90a1663FA6dBD58CC736097E2344bb00",
    "orderManagerImpl": null,
    "providerRegistryProxy": null,
    "treasuryPoolProxy": null,
    "notes": "CREATE2 OM proxy — upgrade via Safe UPGRADER"
  },
  "roles": {
    "admin": "0x0764780a743CBF4CE114C072a8908fb37e5DC71F",
    "upgrader": "0x0764780a743CBF4CE114C072a8908fb37e5DC71F",
    "multisig": "0x0764780a743CBF4CE114C072a8908fb37e5DC71F"
  },
  "deployment": {
    "confirmations": 3,
    "requireDistinctRoles": false,
    "feeBpsDefault": 0,
    "orderTtlDefault": 3600
  }
}
