{
  "chainId": 8453,
  "name": "Base",
  "hardhatNetwork": "base",
  "status": "live",
  "nativeToken": { "symbol": "ETH", "decimals": 18 },
  "rpcEnv": "BASE_MAINNET_RPC",
  "explorer": {
    "browserURL": "https://basescan.org",
    "apiURL": "https://api.basescan.org/api"
  },
  "explorerApiEnv": "BASESCAN_API_KEY",
  "tokens": [
    {
      "symbol": "USDC",
      "address": "0x833589fCD6eDb6E08f4c7C32D4f71b54bdA02913",
      "decimals": 6
    }
  ],
  "contracts": {
    "orderManagerProxy": "0x55f2761afdD2bfBeDeE19D0439d686302CD2b150",
    "orderManagerImpl": "0x6eFD13b4Daeec541F820282baD19A3716D65B59f",
    "providerRegistryProxy": null,
    "treasuryPoolProxy": null,
    "notes": "Pinned 2026-09-13 via on-chain probe: treasury+aggregator+getVersion=1.0.0 (v1 OrderManagement). Registry/Pool are v2-only and not yet deployed on Base."
  },
  "roles": {
    "admin": "0x1eCD465700E4212E807451E2807CB15f3aBf616b",
    "upgrader": "0x1eCD465700E4212E807451E2807CB15f3aBf616b",
    "pauser": "0x1eCD465700E4212E807451E2807CB15f3aBf616b",
    "aggregator": "0x39A8a225DDc4a2980ca24467D67E67Af9C16a3d5",
    "treasury": "0x7E82bAB1C405538521d7702b06F6AcD7950241Df",
    "feeRecipient": null,
    "multisig": null
  },
  "deployment": {
    "confirmations": 2,
    "requireDistinctRoles": true,
    "feeBpsDefault": 0,
    "orderTtlDefault": 3600
  }
}
